{
  "source_key": "duplicate_title",
  "title": "Duplicate Title",
  "content": "second duplicate body",
  "entries": [
    {
      "title": "Same Title",
      "content": "first duplicate body",
      "fetched_at": "2026-07-04T10:00:00+08:00"
    },
    {
      "title": "Same Title",
      "content": "second duplicate body",
      "fetched_at": "2026-07-05T10:00:00+08:00"
    }
  ]
}
